<?xml version="1.0" encoding="utf-8" ?>
<Agents xmlns:xsi="http://www.w3.org/2001/XMLSchema-instance"
         xmlns="http://it-academy.by/romankov"
         xsi:schemaLocation="http://it-academy.by/romankov Agent.xsd">
    <Agent>
        <Name>Dmitry</Name>
        <Telephone>8956235</Telephone>
        <Email>dmitry@mail.ru</Email>
        <Tours>
            <Tour>
                <Type>Beach holidays</Type>
                <Destination> Barselona</Destination>
                <AmountOfDays>11</AmountOfDays>
                <DepartureCity>Minsk</DepartureCity>
                <Price currency="uio">1000</Price>
            </Tour>
            <Tour>
                <Type>Shopping</Type>
                <Destination> Vilnus</Destination>
                <AmountOfDays>1</AmountOfDays>
                <DepartureCity>Minsk</DepartureCity>
                <Price currency="$$$">30</Price>
            </Tour>
        </Tours>
        <Reapeted_Clients>
            <Reapeted_Client>
            <FirstName> Nikita </FirstName>
            <Age>29</Age>
            </Reapeted_Client>
            <Reapeted_Client>
                <FirstName>Anna</FirstName>
                <Age>29</Age>
            </Reapeted_Client>
        </Reapeted_Clients>
    </Agent>
    <Agent>
        <Name>Alisa</Name>
        <Telephone>7896542</Telephone>
        <Email>alisa@mail.ru</Email>
        <Tours>
            <Tour>
                <Type>Excursion</Type>
                <Destination> Krakov</Destination>
                <AmountOfDays>4</AmountOfDays>
                <DepartureCity>Minsk</DepartureCity>
                <Price currency="777">120</Price>
            </Tour>
        </Tours>
        <Reapeted_Clients>
            <Reapeted_Client>
            <FirstName> Ilya </FirstName>
            <Age>31</Age>
            </Reapeted_Client>
        </Reapeted_Clients>
    </Agent>
</Agents>
